{
  "weapons": [
    "W01",
    "W02",
    "W03",
    "W04",
    "W05"
  ],
  "targets": [
    "T01",
    "T02",
    "T03",
    "T04"
  ],
  "target_value": {
    "T01": 66.25,
    "T02": 77.5,
    "T03": 80.5,
    "T04": 91.75
  },
  "weapon_target_completion_probability": {
    "W01": {
      "T01": 0.56,
      "T02": 0.2,
      "T03": 0.405,
      "T04": 0.39
    },
    "W02": {
      "T01": 0.26,
      "T02": 0.465,
      "T03": 0.49,
      "T04": 0.27
    },
    "W03": {
      "T01": 0.525,
      "T02": 0.55,
      "T03": 0.37,
      "T04": 0.355
    },
    "W04": {
      "T01": 0.225,
      "T02": 0.43,
      "T03": 0.455,
      "T04": 0.62
    },
    "W05": {
      "T01": 0.49,
      "T02": 0.515,
      "T03": 0.335,
      "T04": 0.32
    }
  },
  "model_variant": "discrete_and_convex_relaxation",
  "relaxation_requested": true,
  "regularization_parameters_if_saddle_form_requested": {
    "alpha": 0.15,
    "delta": 0.08
  }
}
